{
  "schema_version": "human-corpus-registry/1.0.0",
  "release_id": "human-publications-20261002.1",
  "status": "operational_general_human_corpus_admitted",
  "admitted_on_utc": "2026-10-02",
  "catalog": {
    "path": "ADMITTED_DOCUMENTS.jsonl",
    "bytes": 270416,
    "sha256": "1a44b9893642d4462adcf4d34387136c169cef7b85b08583314de55b948741ac"
  },
  "counts": {
    "general_human_documents": 47,
    "single_author_documents": 46,
    "coauthored_general_human_documents": 1,
    "repeated_named_author_trajectories": 12,
    "by_source": {
      "einfo": 6,
      "guava": 41
    },
    "by_genre": {
      "ethnographic_field_or_travel_essay": 12,
      "film_book_performance_review": 8,
      "personal_or_research_reflection": 6,
      "public_social_commentary": 15,
      "reported_environment_news": 6
    },
    "assistance_status": {
      "unknown": 47
    }
  },
  "default_analysis_policy": "operational-human-publication/1.0.0",
  "optional_stricter_policy": "confirmed-unassisted/1.0.0",
  "date_cutoff": null,
  "requires_pre2022_snapshot": false,
  "source_lineage": {
    "repository": "proffitteoy/style-compiler",
    "commit": "e1119c802ac0c6e42a8e2a0c243ed6b9e3598027",
    "catalogs": [
      {
        "path": "public/ARTICLE_CATALOG.jsonl",
        "bytes": 81655,
        "sha256": "7dede27001f502b3a1d7baf11a5defbcd7139413a9cbbb972b9e6267b3c89d44"
      },
      {
        "path": "public/EINFO_ARTICLE_CATALOG.jsonl",
        "bytes": 9951,
        "sha256": "a9e0b86be4b143a2ac6de43d2fb5cd0546044b8f61af34332b139f0dfd260c9c"
      }
    ]
  },
  "benchmark_effect": "none; no frozen split, feature cache, fit inputs or prior result labels changed",
  "private_body_distribution": "not included; local authorized cache required",
  "experiment_assignment": null
}
